s13t264-201404.pptx,13T264,2014年04月版,
s13t264-201405.pptx,13T264,2014年05月版,電子情報工学科生に勧める初めてのデスクトップPC用キーボード
s13t264-201406.pptx,13T264,2014年06月版,工学部ATMの営業時間延長の提案
s13t264-201407.pptx,13t264,,A Prototype of a Management System for a Lightning Talk in a Circle Scale
tmp.pptx,13T208,2014年12月版,アフレルでのインターンシップ報告python-ev3の教材作成
s13t208-201412.pptx,13T208,2014年12月版,アフレルでのインターンシップ報告python-ev3の教材作成
s13t208-201501.pptx,13T208,2015年01月版,高校生への導入体験としてのLEGOプログラミング演習の支援−LegoSimの実装状況−
s13t208-1203.pptx,13T208,2015年12月版,LeapMotion機器を用いたプレゼンテーション中のポインタ操作の支援ツールのLTでの利用
s13t208-201502.pptx,13T208,2015年02月版,高大連携のLEGOプログラミング講座を支援する統合教材における予習と試行のフェーズの機能
s13t208-201503.pptx,13T208,2015年03月版,2015年度 後期研究室体験 総括
s13t208-201410.pptx,13T208,2014年10月版,
s13t208-201411.pptx,13T208,2014年11月版,アフレルでのインターンシップ報告  EV3-Pythonの教材作成
s13t215-201504.pptx,13T215,2015年04月版,
s13t215-201505.pptx,13T215,2015年05月版,ライターとジッポーの比較
s13t203-201512.pptx,13T203,2015年12月版,ポーカー戦略を題材とする応用Cプログラミング演習の支援と実践－ 大会運営サーバWinTの提出状況とコード比較の機能の追加 －
s13t203-201511.pptx,13T203,2015年11月版,情報環境実験2 グループ課題Bongゲーム紹介
s13t203-201510.pptx,13T203,2015年10月版,
s13t203-201601.pptx,13T203,,セキュリティを意識させる情報リテラシ教育のためのハッキング競技CTFの問題分類と出題形式
s13t250-201508.pptx,13T250,2015年08月版,アックスでのインターンシップ報告
s13t250-201506.pptx,13T250,2015年06月版,第10回 危機管理コンテスト参加報告
s13t250-201504.pptx,13T250,2015年04月版,
s13t250-201505.pptx,13T250,2015年05月版,一戸建てとマンションの比較大学内における消費電力の可視化
s13t250-201509.pptx,13T250,2015年09月版,2015年度 前期研究室体験 総括
s13t250-201507.pptx,13T250,2015年07月版,セキュリティ導入教育のためのハッキング競技CTFのオープン化
s13t210-201412.pptx,13T210,2014年12月版,任天堂でのインターンシップ報告
s13t210-201404.pptx,13T210,2014年04月版,
s13t210-SJCIEE_2015-Oral_2.pptx,13T210,2015年08月版,演習を伴う情報系分野の輪講支援システムのプロジェクト管理の機能
s13t210-201506_2.pptx,13t210,2015年06月版,部室ネットワークの構築
s13t210-201506.pptx,13t210,2015年06月版,部室ネットワークの構築
s13t210-201504.pptx,13t210,2015年04月版,SELinuxの概要
s13t210-201501.pptx,13t210,2015年01月版,NoSQLの概要
s13t210-201511_3.pptx,13T210,2015年11月版,巡回指導支援ツールの試作
s13t210-201511.pptx,13T210,2015年11月版,巡回指導支援ツールの
s13t210-201511_2.pptx,13T210,2015年11月版,巡回指導支援ツールの試作
s13t210-201405.pptx,13T210,2014年05月版,大学生に購入を勧める原付の比較
s13t210-201408.pptx,13T210,2014年08月版,教育支援システムへのWebアクセスの負荷計測ツールの試作
s13t210-201406.pptx,13T210,2014年06月版,冷凍食品用自動販売機の設置の提案
_s13t210-201406.pptx,13T210,2014年06月版,冷凍食品用自動販売機の設置の提案
s13t210-IPSJ_2015-Oral_3.pptx,13T210,2015年02月版,コンピュータ実習とプログラミング演習を伴う情報系分野の輪講支援システムの試作と評価
s11g482-Thesis-Exam-Oral.pptx,11G482,,Monitoring Functions as Teacher Support Sub-system in Introductory C Programming Exercises Based on Small Contest Style
s13t210-201510.pptx,13T210,2015年10月版,実行テスト系列による小コンテスト形式の初級C演習におけるモニタリング機能の改良
s13t210-201409.pptx,13T210,2014年09月版,2014年度 前期研究室体験 総括
s13t210-201503.pptx,13T210,,サークル内のユーザ管理アプリケーションの進捗報告
s13t210-201410.pptx,13T210,2014年10月版,サークル内向けLT実施管理システムの試作
s13t210-201505.pptx,13t210,2015年05月版,サーバの運用方法の提案
s13t210-201505_2.pptx,13t210,2015年05月版,サーバの運用方法の提案
s13t210-201509.pptx,13T210,2015年10月版,競争型学習を取り入れた入門的Cプログラミング演習- 実行テスト系列による部分採点のための柔軟な照合機能 -
s05t287-IPSJ_CE_200903-Oral.pptx,05t287,,競争型学習を取り入れた入門的Cプログラミング演習- 実行テスト系列による部分採点のための柔軟な照合機能 -
s13t210-201411.pptx,13T210,2014年11月版,研究室規模の蔵書管理と文献共有による学習支援－コードレビューを取り入れた共時学習としての輪講の支援－
s13t210-201507.pptx,13T210,2015年07月版,ロジックでのインターンシップ報告
s13t210-201407.pptx,13T210,2014年07月版,教育支援システムへのWebアクセスの負荷計測ツールの試作
